### ISSUE TITLE
Project's use of Tor is opaque

### ISSUE THREAD

**Issue by LinuxforPunks** [haveno-dex/haveno#2380]
(Linux v1.8.0 but was similar on v1.6.0 and one other older version)

Starting ./haveno-desktop opens not the network settings for the user's instructions and configuration, but 'Connecting to Haveno desktop' and 'Bootstrapping to Haveno network failed'

But this is opaque: say instead what address, what protocol and what port is trying to be reached.

The built-in settings: of course those won't work because here you need a Bridge

The timeouts are extremely long (several minutes). After some time the button Open Tor Settings comes available.

The options are:-

############

> Don't use Bridges
> Connect with provided bridges
>> a sub-option Transport Type [obfs4 | obfs3 | meek-amazon | meek-azure]
> Enter one of more bridge relays (one per line)

You need to restart to apply the changes.

############

Entering custom bridges doesn't work even though the bridgelines are known-good and one of them is local and I can make sure it's working.

But two important things are already completely missing: 

1. which Tor is the program trying to use? The local one it shouldn't be using? The remote one it should be using? Its own?

2. no option for SOCK5 proxy. To get onto Tor is difficult where I am, so as well as a Bridge I have proxy servers that can pass my firewall to reach mine or other reliable bridges. It is not your project's fault that my firewall is restrictive and my country doesn't provide an easy environment but the terminal output should show at least which connections the program is trying to bring up.

The log output suggests the bridgelines were parsed ok (when these are the only user-configurable thing!)

```
Jun-27 10:36:55.254 [StartTor-0] INFO  haveno.network.p2p.network.NewTor: Using bridges: obfs4 IP:PORT HASH cert=HASH iat-mode=0,obfs4 IP:PORT HASH cert=HASH iat-mode=0,obfs4 IP:PORT HASH cert=HASH iat-mode=0
Jun-27 10:36:55.285 [StartTor-0] INFO  haveno.network.p2p.network.NewTor: Starting tor
Jun-27 10:37:05.398 [StartTor-0] ERROR h.n.p2p.network.TorNetworkNodeNetlayer: Starting tor node failed org.berndpruenster.netlayer.tor.TorCtlException: Could not setup Tor

```

...but it's installing a version of Tor that (here, for some reason) doesn't work... without saying why it doesn't work. Could be wrong libssl version. Could be it wants a port it can't have. In the log at ~/.local/share/Haveno/haveno.log there is only endless:-

Jun-27 11:32:49.040 [JavaFX Application Thread] INFO  h.c.p.p.PriceFeedService: We received an error at the request from provider http://HASH.onion/. We select the new provider http://HASH.onion/ and use that for a new request in 60 sec.

So here is a further architecture-problem. This broken captive Tor instance is really an essential dependency but haveno-dex continues trying to work without it and generates a long list of these attempts when it should have errored out when its captive Tor instance couldn't connect. In the GUI there is only shown "Connecting to Haveno network" until it gives Connected to Monero Mainnet (No seed nodes available).

The torrc of this Tor instance is in ~/.local/share/Haveno/xmr_mainnet/tor and doesn't specify any logfile.

Lastly, about the lack of the option for SOCKS5 plus the torrc file having ControlPort at the top. That implies this program doesn't just need access to Tor, it is going to spin up a webservice and try to serve it over tor. There is also in here monerod and monero-wallet-rpc. Imo the paradigm of a desktop gui program is misleading, and this wants to be just a docker container in a stack with these other _webservices_ that it relies on.

**Comment by LinuxforPunks** [comment]
from tcpdump it looks as if the problem is that haveno-dex tries to reach its captive tor on random port numbers

```
15:00:34.830722 IP 127.0.0.1.50700 > 127.0.0.1.33331: Flags [F.], seq 105, ack 16, win 64, options [nop,nop,TS val 2617353795 ecr 1340596251], length 0
15:00:34.830735 IP 127.0.0.1.33331 > 127.0.0.1.50700: Flags [.], ack 106, win 64, options [nop,nop,TS val 1340596251 ecr 2617353795], length 0
15:00:34.830779 IP 127.0.0.1.36191 > 127.0.0.1.39966: Flags [P.], seq 36542:36886, ack 640, win 64, options [nop,nop,TS val 3736665072 ecr 2697755616], length 344
15:00:34.830785 IP 127.0.0.1.39966 > 127.0.0.1.36191: Flags [.], ack 36886, win 95, options [nop,nop,TS val 2697755624 ecr 3736665072], length 0
15:00:34.831387 IP 127.0.0.1.33331 > 127.0.0.1.50714: Flags [P.], seq 5:15, ack 105, win 64, options [nop,nop,TS val 1741383184 ecr 1462531485], length 10
15:00:34.831441 IP 127.0.0.1.33331 > 127.0.0.1.50714: Flags [F.], seq 15, ack 105, win 64, options [nop,nop,TS val 1741383184 ecr 1462531485], length 0
15:00:34.831600 IP 127.0.0.1.50714 > 127.0.0.1.33331: Flags [F.], seq 105, ack 16, win 64, options [nop,nop,TS val 1462531494 ecr 1741383184], length 0
15:00:34.831635 IP 127.0.0.1.33331 > 127.0.0.1.50714: Flags [.], ack 106, win 64, options [nop,nop,TS val 1741383185 ecr 1462531494], length 0
15:00:34.831782 IP 127.0.0.1.36191 > 127.0.0.1.39966: Flags [P.], seq 36886:37228, ack 640, win 64, options [nop,nop,TS val 3736665073 ecr 2697755624], length 342
15:00:34.831804 IP 127.0.0.1.39966 > 127.0.0.1.36191: Flags [.], ack 37228, win 95, options [nop,nop,TS val 2697755625 ecr 3736665073], length 0
```

This arises from its torrc having 
SOCKSPort auto
ControlPort auto

And of course it won't work if the user hasn't been advised.

**Comment by woodser** [comment]
#2384 addresses most gaps:

- Surfaces an error on tor startup failure instead of failing silently
- Logs the tor startup mode and socks proxy port if applicable
- Updates the connection config UI with snowflake and custom bridges (WebTunnels recommended)

<img width="1025" height="676" alt="Image" src="https://github.com/user-attachments/assets/580d47a9-d131-42bd-bbd9-150da1afdaa9" />

I also updated the user docs to connect through a proxy and enable tor logging (startup flags only): https://docs.haveno.exchange/users/connectivity/basic-tor/#connect-through-a-proxy
